<?xml version="1.0"?>
<!DOCTYPE list PUBLIC "-//MMBase/DTD editwizard 1.0//EN" "http://www.mmbase.org/dtd/wizard-schema_1_0.dtd">
<list role="imagerel" destination="images" minoccurs="0" maxoccurs="*" orderby="field[@name='order']" ordertype="number">
	<title xml:lang="nl">Afbeelding</title>
	<title xml:lang="en">Image</title>
	
	<item displaytype="image">
	    <field name="title" dtrequired="true">
			<prompt xml:lang="en">Title</prompt>
			<prompt xml:lang="nl">Titel</prompt>
		</field>
	    <field name="description" ftype="text" rows="4">
			<prompt xml:lang="en">Description</prompt>
			<prompt xml:lang="nl">Omschrijving</prompt>
		</field>
	    <field name="handle" ftype="image">
			<prompt xml:lang="en">Image</prompt>
			<prompt xml:lang="nl">Afbeelding</prompt>
		</field>
	</item>
	
	<command name="search" nodepath="images" age="-1" fields="title,description">
		<prompt xml:lang="en">Search image</prompt>
		<prompt xml:lang="nl">Zoek afbeelding</prompt>
		<search-filter>
			<name xml:lang="en">Title contains</name>
			<name xml:lang="nl">Titel bevat</name>
			<search-fields>[title]</search-fields>
		</search-filter>
		<search-filter>
			<name xml:lang="en">Description contains</name>
			<name xml:lang="nl">Omschrijving bevat</name>
			<search-fields>[description]</search-fields>
		</search-filter>
	</command>
	
	<command name="insert" objectnumber="new">
		<prompt xml:lang="en">New</prompt>
		<prompt xml:lang="nl">Nieuw</prompt>
	</command>

	<action type="create">
		<relation role="imagerel">
			<field name="order">{sum(//relation[@role=&apos;imagerel&apos; and @lastitem=&apos;true&apos;]/field[@name=&apos;order&apos;])+{$pos}}</field>
			<object type="images" />
		</relation>
	</action>
</list>