<?xml version="1.0"?>
<!DOCTYPE optionlist PUBLIC "-//MMBase/DTD editwizard 1.0//EN" "http://www.mmbase.org/dtd/wizard-schema_1_0.dtd">
<optionlist name="inputtypes">
   <option id="1">Textbox</option>
   <option id="2">Textarea</option>
   <option id="3">Hidden</option>
   <option id="4">Radio Button</option>
   <option id="5">Select</option>
   <option id="6">Checkbox</option>
   <option id="7">Attachment</option>
</optionlist>
