<?xml version="1.0"?>
<!DOCTYPE form-schema PUBLIC "-//MMBase/DTD editwizard 1.0//EN" "http://www.mmbase.org/dtd/wizard-schema_1_0.dtd">
<form-schema id="edit_site">
	<title xml:lang="nl">Site</title>
	<title xml:lang="en">Site</title>

	<field name="stagingfragment" dtmaxlength="40"
		dtpattern="^[a-zA-Z0-9][a-zA-Z0-9_.-]{0,38}[a-zA-Z0-9]$"
		dtrequired="true">
		<prompt xml:lang="en">Staging domain</prompt>
		<prompt xml:lang="nl">Staging domein</prompt>
	</field>
	<field name="urlfragment" dtmaxlength="40"
		dtpattern="^[a-zA-Z0-9][a-zA-Z0-9_.-]{0,38}[a-zA-Z0-9]$"
		dtrequired="true">
		<prompt xml:lang="en">Live domain</prompt>
		<prompt xml:lang="nl">Live domein</prompt>
	</field>
	<field name="title" dtmaxlength="40" dtrequired="true">
		<prompt xml:lang="en">Title</prompt>
		<prompt xml:lang="nl">Titel</prompt>
	</field>
	<field name="description" dtmaxlength="1024" ftype="text" rows="3">
		<prompt xml:lang="en">Description</prompt>
		<prompt xml:lang="nl">Omschrijving</prompt>
	</field>
	<field name="inmenu" ftype="enum">
		<prompt xml:lang="en">In menu</prompt>
		<prompt xml:lang="nl">In menu</prompt>
		<optionlist select="boolean" />
	</field>
	<field name="secure" ftype="enum">
		<prompt xml:lang="en">Secure</prompt>
		<prompt xml:lang="nl">Beveiligd</prompt>
		<optionlist select="boolean" />
	</field>

	<field name="language" dtmaxlength="2"
>
		<prompt xml:lang="en">Language</prompt>
		<prompt xml:lang="nl">Taal</prompt>
	</field>
	<field name="creator" dtmaxlength="150">
		<prompt xml:lang="en">Creator</prompt>
		<prompt xml:lang="nl">Auteur</prompt>
	</field>
	<field name="publisher" dtmaxlength="150">
		<prompt xml:lang="en">Publisher</prompt>
		<prompt xml:lang="nl">Publicist</prompt>
	</field>
	<field name="source" dtmaxlength="150">
		<prompt xml:lang="en">Source</prompt>
		<prompt xml:lang="nl">Bronvermelding</prompt>
	</field>
	<field name="rights" dtmaxlength="150">
		<prompt xml:lang="en">Rights</prompt>
		<prompt xml:lang="nl">Rechten</prompt>
	</field>

	<list include="config/layout/search_page_layoutrel_layout.xml" />
	<list include="config/stylesheet/search_page_stylerel_stylesheet.xml" />
	<list include="config/images/search_page_namedrel_images.xml" />

	<list include="config/typedef/search_site_allowrel_typedef.xml" />
</form-schema>