<?xml version="1.0"?>
<!DOCTYPE form-schema PUBLIC "-//MMBase/DTD editwizard 1.0//EN" "http://www.mmbase.org/dtd/wizard-schema_1_0.dtd">
<form-schema id="edit_properties">
	<title xml:lang="nl">Instelling</title>
	<title xml:lang="en">Property</title>

	<field name="key" dtmaxlength="40">
		<prompt xml:lang="en">Key</prompt>
		<prompt xml:lang="nl">Naam</prompt>
	</field>
	<field name="description" dtmaxlength="1024" ftype="text" rows="3">
		<prompt xml:lang="en">Description</prompt>
		<prompt xml:lang="nl">Omschrijving</prompt>
	</field>
	<field name="value" dtmaxlength="255" ftype="text" rows="3">
		<prompt xml:lang="en">Value</prompt>
		<prompt xml:lang="nl">Waarde</prompt>
	</field>
	<field name="prod" dtmaxlength="255" ftype="text" rows="3">
		<prompt xml:lang="en">Production</prompt>
		<prompt xml:lang="nl">Productie</prompt>
	</field>
	<field name="preprod" dtmaxlength="255" ftype="text" rows="3">
		<prompt xml:lang="en">Acceptance</prompt>
		<prompt xml:lang="nl">Acceptatie</prompt>
	</field>
	<field name="test" dtmaxlength="255" ftype="text" rows="3">
		<prompt xml:lang="en">Test</prompt>
		<prompt xml:lang="nl">Test</prompt>
	</field>
	<field name="dev" dtmaxlength="255" ftype="text" rows="3">
		<prompt xml:lang="en">Development</prompt>
		<prompt xml:lang="nl">Development</prompt>
	</field>
</form-schema>