<?xml version="1.0"?>
<!DOCTYPE wizard-schema PUBLIC "-//MMBase/DTD editwizard 1.0//EN" "http://www.mmbase.org/dtd/wizard-schema_1_0.dtd">
<wizard-schema id="empty">
  <title xml:lang="nl">Voer hier de wizard titel in</title>
  <title xml:lang="en">Enter Wizard Title Here</title>

  <action type="create">
    <object type="news" />
  </action>

  <action type="delete" />

  <action type="load">
    <blocks classification="test.editwizards" render="head" />
  </action>

  <form-schema id="step1">
    <title>Enter form title here</title>
    <title xml:lang="nl">Voer hier de formulier titel in</title>

    <field name="title" />
    <field name="subtitle" />

    <field name="intro" />

    <field name="body" ftype="html" rows="8" />
    <field name="date" />

  </form-schema>

  <blocks classification="test.editwizards" />

</wizard-schema>
