<?xml version="1.0"?>
<!DOCTYPE optionlist PUBLIC "-//MMBase/DTD editwizard 1.0//EN" "http://www.mmbase.org/dtd/wizard-schema_1_0.dtd">
<optionlist name="persons_rolerel">
  <option id="maintainer">maintainer</option>
  <option id="developer">developer</option>
  <option id="supporter">supporter</option>
  <option id="initiator">initiator</option>
  <option id="questions">questions</option>
  <option id="bugs">bugs</option>
  <option id="support">support</option>
</optionlist>
